{
  "$schema": "./catalog.schema.json",
  "approvalDecisionChoices": [
    "approve_once",
    "reject",
    "allow_session",
    "always_allow"
  ],
  "errorCodes": [
    "internal_error",
    "invalid_params",
    "method_not_found",
    "turn_in_progress",
    "decision_not_pending",
    "clarification_not_pending",
    "incompatible_protocol",
    "not_slash_command",
    "unknown_command",
    "unavailable_surface",
    "unavailable_platform",
    "unavailable_feature",
    "invalid_arguments",
    "unavailable_during_turn",
    "stale_turn",
    "queue_conflict",
    "queue_capacity",
    "queue_worker_start_failed",
    "no_active_turn",
    "turn_id_mismatch",
    "active_turn_not_steerable",
    "input_too_large",
    "message_id_conflict",
	"session_changed",
    "session_not_found",
    "session_in_use",
    "session_state_invalid",
    "session_state_version_unsupported",
    "approval_not_pending",
    "approval_conflict"
  ],
  "modelSelectionScopes": [
    "session",
    "user"
  ],
  "eventStreams": [
	"network.blocked",
    "approval.request",
    "approval.respond",
    "clarify.request",
    "mcp.elicitation.request",
    "mcp.elicitation.respond",
    "clarify.respond",
    "compaction.completed",
    "compaction.started",
    "hook.started",
    "hook.completed",
    "extension.updated",
    "gateway.error",
	"interactive.cancelled",
    "item.completed",
    "item.started",
    "message.complete",
    "message.delta",
    "message.reset",
    "plan.proposed",
    "plan.updated",
    "provider.attempt.updated",
    "reasoning.delta",
    "runtime.event",
    "runtime.ready",
    "session.changed",
    "shell.completed",
    "shell.list.updated",
    "shell.output",
    "shell.removed",
    "shell.started",
    "status.changed",
    "status.update",
    "stream.recovered",
    "stream.retrying",
    "subagent.updated",
    "thinking.delta",
    "tool.complete",
    "tool.failed",
    "tool.progress",
    "tool.start",
    "turn.completed",
    "turn.completion_suppressed",
    "turn.event",
    "turn.failed",
    "turn.interrupted",
    "turn.queue.updated",
    "turn.started",
    "turn.status",
    "workspace.trust.changed"
  ],
  "protocolVersion": 1,
  "rpcMethods": [
    "goal.get",
    "goal.update",
    "skills.list",
    "skills.config.write",
    "hooks.list",
    "hooks.config.write",
    "workspace.diff",
    "session.preview",
    "plugin.inspect",
    "plugin.catalog",
    "plugin.operation.start",
    "plugin.operation.get",
    "plugin.operation.cancel",
    "approval.respond",
    "auth.api_key.save",
    "clarify.respond",
    "mcp.elicitation.respond",
    "command.list",
    "command.run",
    "completion.path",
    "completion.slash",
    "decision.resolve",
    "extension.manifest",
    "model.list",
    "model.select",
    "permissions.list",
    "permissions.update",
	"provider.list",
	"provider.connectivity.validate",
    "resource.list",
    "session.bootstrap",
    "session.list",
	"session.new",
    "session.resume",
	"session.tree",
	"settings.load",
	"settings.keymap.reset",
	"settings.save",
	"shell.list",
	"shell.output.load",
	"shell.stop",
	"shell.stop_all",
	"shutdown",
    "status.inspect",
	"trace.export",
	"transcript.load",
	"provider.attempts.load",
	"update.dismiss",
	"update.status",
	"turn.follow_up",
    "turn.interrupt",
    "turn.queue.clear",
    "turn.queue.migration.ack",
    "turn.queue.pop",
	"turn.queue.restore.ack",
    "turn.steer",
    "turn.submit",
    "workspace.trust.set",
    "workspace.trust.status",
    "worktree.list",
    "worktree.start",
    "worktree.remove"
  ],
  "terminalTurnStates": [
    "waiting_approval",
    "waiting_clarification",
    "completed",
    "failed",
    "interrupted",
    "rejected"
  ]
}
